{
  "$schema": "http://json-schema.org/draft-07/schema#",
  "title": "Armor",
  "description": "Data definition for a piece of armor providing zone coverage in combat.",
  "type": "object",
  "required": ["id", "name", "material_id", "layer", "coverage_zones", "encumbrance", "durability"],
  "additionalProperties": false,
  "properties": {
    "$schema": { "type": "string" },
    "id":   { "type": "string" },
    "name": { "type": "string" },
    "description": { "type": "string" },
    "material_id": {
      "type": "string",
      "description": "Reference to data/materials/<id>.json. Determines DR bonuses on top of item base stats."
    },
    "material": {
      "type": "string",
      "enum": ["gambeson", "leather", "mail", "plate"],
      "description": "Legacy broad category (kept for backwards compat). Prefer material_id."
    },
    "layer": {
      "type": "string",
      "enum": ["base_layer", "clothing", "armor", "shield"],
      "description": "Wear layer. base_layer = innermost (linen shirt); clothing = mid (wool tunic, padded jack); armor = outer protective (mail, plate); shield = held in off-hand."
    },
    "quality": {
      "type": "string",
      "enum": ["poor", "standard", "fine", "masterwork"],
      "default": "standard",
      "description": "Crafting quality. Modifies DR: poor=×0.75, standard=×1.0, fine=×1.25, masterwork=×1.5."
    },
    "coverage_zones": {
      "type": "object",
      "description": "body_zone_id -> coverage float (0.0 = no protection, 1.0 = full protection). Unlisted zones have 0 coverage.",
      "additionalProperties": { "type": "number", "minimum": 0, "maximum": 1 }
    },
    "damage_reduction": {
      "type": "object",
      "description": "Per damage_type flat reduction applied before coverage. Keys: slash, pierce, blunt.",
      "properties": {
        "slash":  { "type": "number", "minimum": 0 },
        "pierce": { "type": "number", "minimum": 0 },
        "blunt":  { "type": "number", "minimum": 0 }
      },
      "additionalProperties": false
    },
    "encumbrance": {
      "type": "number",
      "minimum": 0,
      "description": "Movement penalty contribution. Total encumbrance above threshold reduces speed and stamina regen."
    },
    "durability": {
      "type": "integer",
      "minimum": 1,
      "description": "Max durability points. Each hit that penetrates coverage reduces durability by 1. At 0, armor is destroyed."
    },
    "equip_slot": {
      "type": "string",
      "enum": ["head", "torso", "arms", "legs", "hands", "feet"],
      "description": "Equipment slot this piece occupies."
    },
    "tags": {
      "type": "array",
      "items": { "type": "string" }
    },
    "weight_kg": {
      "type": "number",
      "minimum": 0
    },
    "value_coin": {
      "type": "number",
      "minimum": 0
    }
  }
}
