{
  "$schema": "../schemas/armor.schema.json",
  "id": "iron_helm",
  "name": "Iron Helm",
  "description": "A simple iron bowl helm. Minimal coverage but significantly reduces lethal head wounds.",
  "material": "plate",
  "material_id": "iron",
  "layer": "armor",
  "quality": "standard",
  "coverage_zones": {
    "head": 0.80
  },
  "damage_reduction": { "slash": 5, "pierce": 4, "blunt": 5 },
  "encumbrance": 1.5,
  "durability": 25,
  "equip_slot": "head",
  "tags": ["military", "common"],
  "weight_kg": 1.8,
  "value_coin": 20
}
